TABLE_NAME,COLUMN_NAME,IS_NULLABLE,DATA_TYPE,DESCRIPTION
DRUG_EXPOSURE,ROUTE_CONCEPT_ID,NO,INTEGER,A FOREIGN KEY TO A PREDEFINED CONCEPT IN THE STANDARDIZED VOCABULARIES REFLECTING THE ROUTE OF ADMINISTRATION.
DRUG_EXPOSURE,EFFECTIVE_DRUG_DOSE,NO,FLOAT,NUMERICAL VALUE OF DRUG DOSE FOR THIS DRUG EXPOSURE RECORD.
DRUG_EXPOSURE,DOSE_UNIT_CONCEPT_ ID,NO,INTEGER,A FOREIGN KEY TO A PREDEFINED CONCEPT IN THE STANDARDIZED VOCABULARIES REFLECTING THE UNIT THE EFFECTIVE_DRUG_DOSE VALUE IS EXPRESSED.
DRUG_EXPOSURE,LOT_NUMBER,NO,VARCHAR(50),AN IDENTIFIER ASSIGNED TO A PARTICULAR QUANTITY OR LOT OF DRUG PRODUCT FROM THE MANUFACTURER.
DRUG_EXPOSURE,PROVIDER_ID,NO,INTEGER,A FOREIGN KEY TO THE PROVIDER IN THE PROVIDER TABLE WHO INITIATED (PRESCRIBED OR ADMINISTERED) THE DRUG EXPOSURE.
DRUG_EXPOSURE,VISIT_OCCURRENCE_ID,NO,INTEGER,A FOREIGN KEY TO THE VISIT IN THE VISIT TABLE DURING WHICH THE DRUG EXPOSURE WAS INITIATED.
DRUG_EXPOSURE,DRUG_SOURCE_VALUE,NO,VARCHAR(50),"THE SOURCE CODE FOR THE DRUG AS IT APPEARS IN THE SOURCE DATA. THIS CODE IS MAPPED TO A STANDARD DRUG CONCEPT IN THE STANDARDIZED VOCABULARIES AND THE ORIGINAL CODE IS, STORED HERE FOR REFERENCE."
DRUG_EXPOSURE,DRUG_SOURCE_CONCEPT_ID,NO,INTEGER,A FOREIGN KEY TO A DRUG CONCEPT THAT REFERS TO THE CODE USED IN THE SOURCE.
DRUG_EXPOSURE,ROUTE_SOURCE_VALUE,NO,VARCHAR(50),THE INFORMATION ABOUT THE ROUTE OF ADMINISTRATION AS DETAILED IN THE SOURCE.
DRUG_EXPOSURE,DOSE_UNIT_SOURCE_VALUE,NO,VARCHAR(50),THE INFORMATION ABOUT THE DOSE UNIT AS DETAILED IN THE SOURCE.
DEVICE_EXPOSURE,DEVICE_EXPOSURE_ID,YES,INTEGER,A SYSTEM-GENERATED UNIQUE IDENTIFIER FOR EACH DEVICE EXPOSURE.
DEVICE_EXPOSURE,PERSON_ID,YES,INTEGER,A FOREIGN KEY IDENTIFIER TO THE PERSON WHO IS SUBJECTED TO THE DEVICE. THE DEMOGRAPHIC DETAILS OF THAT PERSON ARE STORED IN THE PERSON TABLE.
DEVICE_EXPOSURE,DEVICE_CONCEPT_ID,YES,INTEGER,A FOREIGN KEY THAT REFERS TO A STANDARD CONCEPT IDENTIFIER IN THE STANDARDIZED VOCABULARIES FOR THE DEVICE CONCEPT.
DEVICE_EXPOSURE,DEVICE_EXPOSURE_START_DATE,YES,DATE,THE DATE THE DEVICE OR SUPPLY WAS APPLIED OR USED.
DEVICE_EXPOSURE,DEVICE_EXPOSURE_START_DATETIME,NO,DATETIME,THE DATE AND TIME THE DEVICE OR SUPPLY WAS APPLIED OR USED.
DEVICE_EXPOSURE,DEVICE_EXPOSURE_END_DATE,NO,DATE,THE DATE THE DEVICE OR SUPPLY WAS REMOVED FROM USE.
DEVICE_EXPOSURE,DEVICE_EXPOSURE_END_DATETIME,NO,DATETIME,THE DATE AND TIME THE DEVICE OR SUPPLY WAS REMOVED FROM USE.
DEVICE_EXPOSURE,DEVICE_TYPE_CONCEPT_ID,YES,INTEGER,A FOREIGN KEY TO THE PREDEFINED CONCEPT IDENTIFIER IN THE STANDARDIZED VOCABULARIES REFLECTING THE TYPE OF DEVICE EXPOSURE RECORDED. IT INDICATES HOW THE DEVICE EXPOSURE WAS REPRESENTED IN THE SOURCE DATA.
DEVICE_EXPOSURE,UNIQUE_DEVICE_ID,NO,VARCHAR(50),A UDI OR EQUIVALENT IDENTIFYING THE INSTANCE OF THE DEVICE USED IN THE PERSON.
DEVICE_EXPOSURE,QUANTITY,NO,INTEGER,THE NUMBER OF INDIVIDUAL DEVICES USED FOR THE EXPOSURE.
DEVICE_EXPOSURE,PROVIDER_ID,NO,INTEGER,A FOREIGN KEY TO THE PROVIDER IN THE PROVIDER TABLE WHO INITIATED OF ADMINISTERED THE DEVICE.
DEVICE_EXPOSURE,VISIT_OCCURRENCE_ID,NO,INTEGER,A FOREIGN KEY TO THE VISIT IN THE VISIT TABLE DURING WHICH THE DEVICE WAS USED.
DEVICE_EXPOSURE,DEVICE_SOURCE_VALUE,NO,VARCHAR(50),THE SOURCE CODE FOR THE DEVICE AS IT APPEARS IN THE SOURCE DATA. THIS CODE IS MAPPED TO A STANDARD DEVICE CONCEPT IN THE STANDARDIZED VOCABULARIES AND THE ORIGINAL CODE IS STORED HERE FOR REFERENCE.
DEVICE_EXPOSURE,DEVICE_SOURCE_ CONCEPT_ID,NO,INTEGER,A FOREIGN KEY TO A DEVICE CONCEPT THAT REFERS TO THE CODE USED IN THE SOURCE.
CONDITION_OCCURRENCE,CONDITION_OCCURRENCE_ID,YES,INTEGER,A UNIQUE IDENTIFIER FOR EACH CONDITION OCCURRENCE EVENT.
CONDITION_OCCURRENCE,PERSON_ID,YES,INTEGER,A FOREIGN KEY IDENTIFIER TO THE PERSON WHO IS EXPERIENCING THE CONDITION. THE DEMOGRAPHIC DETAILS OF THAT PERSON ARE STORED IN THE PERSON TABLE.
CONDITION_OCCURRENCE,CONDITION_CONCEPT_ID,YES,INTEGER,A FOREIGN KEY THAT REFERS TO A STANDARD CONDITION CONCEPT IDENTIFIER IN THE STANDARDIZED VOCABULARIES.
CONDITION_OCCURRENCE,CONDITION_START_DATE,YES,DATE,THE DATE WHEN THE INSTANCE OF THE CONDITION IS RECORDED.
CONDITION_OCCURRENCE,CONDITION_START_DATETIME,NO,DATETIME,THE DATE AND TIME WHEN THE INSTANCE OF THE CONDITION IS RECORDED.
CONDITION_OCCURRENCE,CONDITION_END_DATE,NO,DATE,THE DATE WHEN THE INSTANCE OF THE CONDITION IS CONSIDERED TO HAVE ENDED.
CONDITION_OCCURRENCE,CONDITION_END_DATETIME,NO,DATE,THE DATE WHEN THE INSTANCE OF THE CONDITION IS CONSIDERED TO HAVE ENDED.
CONDITION_OCCURRENCE,CONDITION_TYPE_CONCEPT_ID,YES,INTEGER,"A FOREIGN KEY TO THE PREDEFINED CONCEPT IDENTIFIER IN THE STANDARDIZED VOCABULARIES REFLECTING THE SOURCE DATA FROM WHICH THE CONDITION WAS RECORDED, THE LEVEL OF STANDARDIZATION, AND THE TYPE OF OCCURRENCE."
CONDITION_OCCURRENCE,STOP_REASON,NO,VARCHAR(20),"THE REASON THAT THE CONDITION WAS NO LONGER PRESENT, AS INDICATED IN THE SOURCE DATA."
CONDITION_OCCURRENCE,PROVIDER_ID,NO,INTEGER,A FOREIGN KEY TO THE PROVIDER IN THE PROVIDER TABLE WHO WAS RESPONSIBLE FOR CAPTURING (DIAGNOSING) THE CONDITION.
CONDITION_OCCURRENCE,VISIT_OCCURRENCE_ID,NO,INTEGER,A FOREIGN KEY TO THE VISIT IN THE VISIT TABLE DURING WHICH THE CONDITION WAS DETERMINED (DIAGNOSED).
CONDITION_OCCURRENCE,CONDITION_STATUS_CONCEPT_ID,NO,INTEGER,A FOREIGN KEY TO THE PREDEFINED CONCEPT IN THE STANDARD VOCABULARY REFLECTING THE CONDITION STATUS.
CONDITION_OCCURRENCE,CONDITION_SOURCE_CONCEPT_ID,NO,INTEGER,A FOREIGN KEY TO A CONDITION CONCEPT THAT REFERS TO THE CODE USED IN THE SOURCE.
CONDITION_OCCURRENCE,CONDITION_SOURCE_VALUE,NO,VARCHAR(50),THE SOURCE CODE FOR THE CONDITION AS IT APPEARS IN THE SOURCE DATA. THIS CODE IS MAPPED TO A STANDARD CONDITION CONCEPT IN THE STANDARDIZED VOCABULARIES AND THE ORIGINAL CODE IS STORED HERE FOR REFERENCE.
CONDITION_OCCURRENCE,CONDITION_STATUS_SOURCE_VALUE,NO,VARCHAR(50),
MEASUREMENT,MEASUREMENT_ID,YES,INTEGER,A UNIQUE IDENTIFIER FOR EACH MEASUREMENT.
MEASUREMENT,PERSON_ID,YES,INTEGER,A FOREIGN KEY IDENTIFIER TO THE PERSON ABOUT WHOM THE MEASUREMENT WAS RECORDED. THE DEMOGRAPHIC DETAILS OF THAT PERSON ARE STORED IN THE PERSON TABLE.
MEASUREMENT,MEASUREMENT_CONCEPT_ID,YES,INTEGER,A FOREIGN KEY TO THE STANDARD MEASUREMENT CONCEPT IDENTIFIER IN THE STANDARDIZED VOCABULARIES.
MEASUREMENT,MEASUREMENT_DATE,YES,DATE,THE DATE OF THE MEASUREMENT.
MEASUREMENT,MEASUREMENT_DATETIME,NO,DATETIME,"THE DATE AND TIME OF THE MEASUREMENT. (SOME DATABASE SYSTEMS DON'T HAVE A DATATYPE OF TIME. TO ACCOMODATE ALL TEMPORAL ANALYSES, DATATYPE DATETIME CAN BE USED (COMBINING MEASUREMENT_DATE AND MEASUREMENT_TIME)RELEVANT FORUM DISCUSSION"
MEASUREMENT,MEASUREMENT_TYPE_CONCEPT_ID,YES,INTEGER,A FOREIGN KEY TO THE PREDEFINED CONCEPT IN THE STANDARDIZED VOCABULARIES REFLECTING THE PROVENANCE FROM WHERE THE MEASUREMENT RECORD WAS RECORDED.
MEASUREMENT,OPERATOR_CONCEPT_ID,NO,INTEGER,"A FOREIGN KEY IDENTIFIER TO THE PREDEFINED CONCEPT IN THE STANDARDIZED VOCABULARIES REFLECTING THE MATHEMATICAL OPERATOR THAT IS APPLIED TO THE VALUE_AS_NUMBER. OPERATORS ARE <, Ó, =, Ò, >."
MEASUREMENT,VALUE_AS_NUMBER,NO,FLOAT,A MEASUREMENT RESULT WHERE THE RESULT IS EXPRESSED AS A NUMERIC VALUE.
MEASUREMENT,VALUE_AS_CONCEPT_ID,NO,INTEGER,"A FOREIGN KEY TO A MEASUREMENT RESULT REPRESENTED AS A CONCEPT FROM THE STANDARDIZED VOCABULARIES (E.G., POSITIVE/NEGATIVE, PRESENT/ABSENT, LOW/HIGH, ETC.)."
MEASUREMENT,UNIT_CONCEPT_ID,NO,INTEGER,A FOREIGN KEY TO A STANDARD CONCEPT ID OF MEASUREMENT UNITS IN THE STANDARDIZED VOCABULARIES.
MEASUREMENT,RANGE_LOW,NO,FLOAT,THE LOWER LIMIT OF THE NORMAL RANGE OF THE MEASUREMENT RESULT. THE LOWER RANGE IS ASSUMED TO BE OF THE SAME UNIT OF MEASURE AS THE MEASUREMENT VALUE.
MEASUREMENT,RANGE_HIGH,NO,FLOAT,THE UPPER LIMIT OF THE NORMAL RANGE OF THE MEASUREMENT. THE UPPER RANGE IS ASSUMED TO BE OF THE SAME UNIT OF MEASURE AS THE MEASUREMENT VALUE.
MEASUREMENT,PROVIDER_ID,NO,INTEGER,A FOREIGN KEY TO THE PROVIDER IN THE PROVIDER TABLE WHO WAS RESPONSIBLE FOR INITIATING OR OBTAINING THE MEASUREMENT.
MEASUREMENT,VISIT_OCCURRENCE_ID,NO,INTEGER,A FOREIGN KEY TO THE VISIT IN THE VISIT_OCCURRENCE TABLE DURING WHICH THE MEASUREMENT WAS RECORDED.
MEASUREMENT,MEASUREMENT_SOURCE_VALUE,NO,VARCHAR(50),THE MEASUREMENT NAME AS IT APPEARS IN THE SOURCE DATA. THIS CODE IS MAPPED TO A STANDARD CONCEPT IN THE STANDARDIZED VOCABULARIES AND THE ORIGINAL CODE IS STORED HERE FOR REFERENCE.
MEASUREMENT,MEASUREMENT_SOURCE_CONCEPT_ID,NO,INTEGER,A FOREIGN KEY TO A CONCEPT IN THE STANDARD VOCABULARIES THAT REFERS TO THE CODE USED IN THE SOURCE.
MEASUREMENT,UNIT_SOURCE_VALUE,NO,VARCHAR(50),THE SOURCE CODE FOR THE UNIT AS IT APPEARS IN THE SOURCE DATA. THIS CODE IS MAPPED TO A STANDARD UNIT CONCEPT IN THE STANDARDIZED VOCABULARIES AND THE ORIGINAL CODE IS STORED HERE FOR REFERENCE.
MEASUREMENT,VALUE_SOURCE_VALUE,NO,VARCHAR(50),THE SOURCE VALUE ASSOCIATED WITH THE CONTENT OF THE VALUE_AS_NUMBER OR VALUE_AS_CONCEPT_ID AS STORED IN THE SOURCE DATA.
NOTE,NOTE_ID,YES,INTEGER,A UNIQUE IDENTIFIER FOR EACH NOTE.
NOTE,PERSON_ID,YES,INTEGER,A FOREIGN KEY IDENTIFIER TO THE PERSON ABOUT WHOM THE NOTE WAS RECORDED. THE DEMOGRAPHIC DETAILS OF THAT PERSON ARE STORED IN THE PERSON TABLE.
NOTE,NOTE_DATE,YES,DATE,THE DATE THE NOTE WAS RECORDED.
NOTE,NOTE_DATETIME,NO,DATETIME,THE DATE AND TIME THE NOTE WAS RECORDED.
NOTE,NOTE_TYPE_CONCEPT_ID,YES,INTEGER,"A FOREIGN KEY TO THE PREDEFINED CONCEPT IN THE STANDARDIZED VOCABULARIES REFLECTING THE TYPE, ORIGIN OR PROVENANCE OF THE NOTE."
NOTE,NOTE_CLASS_CONCEPT_ID,YES,INTEGER,A FOREIGN KEY TO THE PREDEFINED CONCEPT IN THE STANDARDIZED VOCABULARIES REFLECTING THE HL7 LOINC DOCUMENT TYPE VOCABULARY CLASSIFICATION OF THE NOTE.
NOTE,NOTE_TITLE,NO,STRING(250),THE TITLE OF THE NOTE AS IT APPEARS IN THE SOURCE.
NOTE,NOTE_TEXT,NO,RBDMS DEPENDENT TEXT,THE CONTENT OF THE NOTE.
NOTE,ENCODING_CONCEPT_ID,YES,INTEGER,A FOREIGN KEY TO THE PREDEFINED CONCEPT IN THE STANDARDIZED VOCABULARIES REFLECTING THE NOTE CHARACTER ENCODING TYPE.
NOTE,LANGUAGE_CONCEPT_ID,YES,INTEGER,A FOREIGN KEY TO THE PREDEFINED CONCEPT IN THE STANDARDIZED VOCABULARIES REFLECTING THE LANGUAGE OF THE NOTE.
NOTE,PROVIDER_ID,NO,INTEGER,A FOREIGN KEY TO THE PROVIDER IN THE PROVIDER TABLE WHO TOOK THE NOTE.
NOTE,VISIT_OCCURRENCE_ID,NO,INTEGER,FOREIGN KEY TO THE VISIT IN THE VISIT_OCCURRENCE TABLE WHEN THE NOTE WAS TAKEN.
OBSERVATION,OBSERVATION_ID,YES,INTEGER,A UNIQUE IDENTIFIER FOR EACH OBSERVATION.
OBSERVATION,PERSON_ID,YES,INTEGER,A FOREIGN KEY IDENTIFIER TO THE PERSON ABOUT WHOM THE OBSERVATION WAS RECORDED. THE DEMOGRAPHIC DETAILS OF THAT PERSON ARE STORED IN THE PERSON TABLE.
OBSERVATION,OBSERVATION_CONCEPT_ID,YES,INTEGER,A FOREIGN KEY TO THE STANDARD OBSERVATION CONCEPT IDENTIFIER IN THE STANDARDIZED VOCABULARIES.
OBSERVATION,OBSERVATION_DATE,YES,DATE,THE DATE OF THE OBSERVATION.
OBSERVATION,OBSERVATION_DATETIME,NO,DATETIME,THE DATE AND TIME OF THE OBSERVATION.
OBSERVATION,OBSERVATION_TYPE_CONCEPT_ID,YES,INTEGER,A FOREIGN KEY TO THE PREDEFINED CONCEPT IDENTIFIER IN THE STANDARDIZED VOCABULARIES REFLECTING THE TYPE OF THE OBSERVATION.
OBSERVATION,VALUE_AS_NUMBER,NO,FLOAT,THE OBSERVATION RESULT STORED AS A NUMBER. THIS IS APPLICABLE TO OBSERVATIONS WHERE THE RESULT IS EXPRESSED AS A NUMERIC VALUE.
OBSERVATION,VALUE_AS_STRING,NO,VARCHAR(60),THE OBSERVATION RESULT STORED AS A STRING. THIS IS APPLICABLE TO OBSERVATIONS WHERE THE RESULT IS EXPRESSED AS VERBATIM TEXT.
OBSERVATION,VALUE_AS_CONCEPT_ID,NO,INTEGER,"A FOREIGN KEY TO AN OBSERVATION RESULT STORED AS A CONCEPT ID. THIS IS APPLICABLE TO OBSERVATIONS WHERE THE RESULT CAN BE EXPRESSED AS A STANDARD CONCEPT FROM THE STANDARDIZED VOCABULARIES (E.G., POSITIVE/NEGATIVE, PRESENT/ABSENT, LOW/HIGH, ETC.)."
OBSERVATION,QUALIFIER_CONCEPT_ID,NO,INTEGER,"A FOREIGN KEY TO A STANDARD CONCEPT ID FOR A QUALIFIER (E.G., SEVERITY OF DRUG-DRUG INTERACTION ALERT)"
OBSERVATION,UNIT_CONCEPT_ID,NO,INTEGER,A FOREIGN KEY TO A STANDARD CONCEPT ID OF MEASUREMENT UNITS IN THE STANDARDIZED VOCABULARIES.
OBSERVATION,PROVIDER_ID,NO,INTEGER,A FOREIGN KEY TO THE PROVIDER IN THE PROVIDER TABLE WHO WAS RESPONSIBLE FOR MAKING THE OBSERVATION.
OBSERVATION,VISIT_OCCURRENCE_ID,NO,INTEGER,A FOREIGN KEY TO THE VISIT IN THE VISIT_OCCURRENCE TABLE DURING WHICH THE OBSERVATION WAS RECORDED.
OBSERVATION,OBSERVATION_SOURCE_VALUE,NO,VARCHAR(50),"THE OBSERVATION CODE AS IT APPEARS IN THE SOURCE DATA. THIS CODE IS MAPPED TO A STANDARD CONCEPT IN THE STANDARDIZED VOCABULARIES AND THE ORIGINAL CODE IS, STORED HERE FOR REFERENCE."
OBSERVATION,OBSERVATION_SOURCE_CONCEPT_ID,NO,INTEGER,A FOREIGN KEY TO A CONCEPT THAT REFERS TO THE CODE USED IN THE SOURCE.
OBSERVATION,UNIT_SOURCE_VALUE,NO,VARCHAR(50),"THE SOURCE CODE FOR THE UNIT AS IT APPEARS IN THE SOURCE DATA. THIS CODE IS MAPPED TO A STANDARD UNIT CONCEPT IN THE STANDARDIZED VOCABULARIES AND THE ORIGINAL CODE IS, STORED HERE FOR REFERENCE."
OBSERVATION,QUALIFIER_SOURCE_VALUE,NO,VARCHAR(50),THE SOURCE VALUE ASSOCIATED WITH A QUALIFIER TO CHARACTERIZE THE OBSERVATION
FACT_RELATIONSHIP,DOMAIN_CONCEPT _ID_1,YES,INTEGER,"THE CONCEPT REPRESENTING THE DOMAIN OF FACT ONE, FROM WHICH THE CORRESPONDING TABLE CAN BE INFERRED."
FACT_RELATIONSHIP,FACT_ID_1,YES,INTEGER,THE UNIQUE IDENTIFIER IN THE TABLE CORRESPONDING TO THE DOMAIN OF FACT ONE.
FACT_RELATIONSHIP,DOMAIN_CONCEPT_ID_2,YES,INTEGER,"THE CONCEPT REPRESENTING THE DOMAIN OF FACT TWO, FROM WHICH THE CORRESPONDING TABLE CAN BE INFERRED."
FACT_RELATIONSHIP,FACT_ID_2,YES,INTEGER,THE UNIQUE IDENTIFIER IN THE TABLE CORRESPONDING TO THE DOMAIN OF FACT TWO.
FACT_RELATIONSHIP,RELATIONSHIP_CONCEPT_ID,YES,INTEGER,A FOREIGN KEY TO A STANDARD CONCEPT ID OF RELATIONSHIP IN THE STANDARDIZED VOCABULARIES.
LOCATION,LOCATION_ID,YES,INTEGER,A UNIQUE IDENTIFIER FOR EACH GEOGRAPHIC LOCATION.
LOCATION,ADDRESS_1,NO,VARCHAR(50),"THE ADDRESS FIELD 1, TYPICALLY USED FOR THE STREET ADDRESS, AS IT APPEARS IN THE SOURCE DATA."
LOCATION,ADDRESS_2,NO,VARCHAR(50),"THE ADDRESS FIELD 2, TYPICALLY USED FOR ADDITIONAL DETAIL SUCH AS BUILDINGS, SUITES, FLOORS, AS IT APPEARS IN THE SOURCE DATA."
LOCATION,CITY,NO,VARCHAR(50),THE CITY FIELD AS IT APPEARS IN THE SOURCE DATA.
LOCATION,STATE,NO,VARCHAR(2),THE STATE FIELD AS IT APPEARS IN THE SOURCE DATA.
LOCATION,ZIP,NO,VARCHAR(9),THE ZIP OR POSTAL CODE.
LOCATION,COUNTY,NO,VARCHAR(20),THE COUNTY.
LOCATION,LOCATION_SOURCE_VALUE,NO,VARCHAR(50),THE VERBATIM INFORMATION THAT IS USED TO UNIQUELY IDENTIFY THE LOCATION AS IT APPEARS IN THE SOURCE DATA.
CARE_SITE,CARE_SITE_ID,YES,INTEGER,A UNIQUE IDENTIFIER FOR EACH CARE SITE.
CARE_SITE,CARE_SITE_NAME,NO,VARCHAR(255),THE VERBATIM DESCRIPTION OR NAME OF THE CARE SITE AS IN DATA SOURCE
CARE_SITE,PLACE_OF_SERVICE_CONCEPT_ID,NO,INTEGER,A FOREIGN KEY THAT REFERS TO A PLACE OF SERVICE CONCEPT ID IN THE STANDARDIZED VOCABULARIES.
CARE_SITE,LOCATION_ID,NO,INTEGER,"A FOREIGN KEY TO THE GEOGRAPHIC LOCATION IN THE LOCATION TABLE, WHERE THE DETAILED ADDRESS INFORMATION IS STORED."
CARE_SITE,CARE_SITE_SOURCE_VALUE,NO,VARCHAR(50),"THE IDENTIFIER FOR THE CARE SITE IN THE SOURCE DATA, STORED HERE FOR REFERENCE."
CARE_SITE,PLACE_OF_SERVICE_SOURCE_VALUE,NO,VARCHAR(50),"THE SOURCE CODE FOR THE PLACE OF SERVICE AS IT APPEARS IN THE SOURCE DATA, STORED HERE FOR REFERENCE."
PROVIDER,PROVIDER_ID,YES,INTEGER,A UNIQUE IDENTIFIER FOR EACH PROVIDER.
PROVIDER,PROVIDER_NAME,NO,VARCHAR(50),A DESCRIPTION OF THE PROVIDER.
PROVIDER,NPI,NO,VARCHAR(20),THE NATIONAL PROVIDER IDENTIFIER (NPI) OF THE PROVIDER.
PROVIDER,DEA,NO,VARCHAR(20),THE DRUG ENFORCEMENT ADMINISTRATION (DEA) NUMBER OF THE PROVIDER.
PROVIDER,SPECIALTY_CONCEPT_ID,NO,INTEGER,A FOREIGN KEY TO A STANDARD SPECIALTY CONCEPT ID IN THE STANDARDIZED VOCABULARIES.
PROVIDER,CARE_SITE_ID,NO,INTEGER,A FOREIGN KEY TO THE MAIN CARE SITE WHERE THE PROVIDER IS PRACTICING.
PROVIDER,YEAR_OF_BIRTH,NO,INTEGER,THE YEAR OF BIRTH OF THE PROVIDER.
PROVIDER,GENDER_CONCEPT_ID,NO,INTEGER,THE GENDER OF THE PROVIDER.
PROVIDER,PROVIDER_SOURCE_VALUE,NO,VARCHAR(50),"THE IDENTIFIER USED FOR THE PROVIDER IN THE SOURCE DATA, STORED HERE FOR REFERENCE."
PROVIDER,SPECIALTY_SOURCE_VALUE,NO,VARCHAR(50),"THE SOURCE CODE FOR THE PROVIDER SPECIALTY AS IT APPEARS IN THE SOURCE DATA, STORED HERE FOR REFERENCE."
PROVIDER,SPECIALTY_SOURCE_CONCEPT_ID,NO,INTEGER,A FOREIGN KEY TO A CONCEPT THAT REFERS TO THE CODE USED IN THE SOURCE.
PROVIDER,GENDER_SOURCE_VALUE,NO,VARCHAR(50),"THE GENDER CODE FOR THE PROVIDER AS IT APPEARS IN THE SOURCE DATA, STORED HERE FOR REFERENCE."
PROVIDER,GENDER_SOURCE_CONCEPT_ID,NO,INTEGER,A FOREIGN KEY TO A CONCEPT THAT REFERS TO THE CODE USED IN THE SOURCE.
PAYER_PLAN_PERIOD,PAYER_PLAN_PERIOD_ID,YES,INTEGER,"A IDENTIFIER FOR EACH UNIQUE COMBINATION OF PAYER, PLAN, FAMILY CODE AND TIME SPAN."
PAYER_PLAN_PERIOD,PERSON_ID,YES,INTEGER,A FOREIGN KEY IDENTIFIER TO THE PERSON COVERED BY THE PAYER. THE DEMOGRAPHIC DETAILS OF THAT PERSON ARE STORED IN THE PERSON TABLE.
PAYER_PLAN_PERIOD,PAYER_PLAN_PERIOD_START_DATE,YES,DATE,THE START DATE OF THE PAYER PLAN PERIOD.
PAYER_PLAN_PERIOD,PAYER_PLAN_PERIOD_END_DATE,YES,DATE,THE END DATE OF THE PAYER PLAN PERIOD.
PAYER_PLAN_PERIOD,PAYER_SOURCE_VALUE,NO,VARCHAR(50),THE SOURCE CODE FOR THE PAYER AS IT APPEARS IN THE SOURCE DATA.
PAYER_PLAN_PERIOD,PLAN_SOURCE_VALUE,NO,VARCHAR(50),THE SOURCE CODE FOR THE PERSON'S HEALTH BENEFIT PLAN AS IT APPEARS IN THE SOURCE DATA.
PAYER_PLAN_PERIOD,FAMILY_SOURCE_VALUE,NO,VARCHAR(50),THE SOURCE CODE FOR THE PERSON'S FAMILY AS IT APPEARS IN THE SOURCE DATA.
COST,COST_ID,YES,INTEGER,A UNIQUE IDENTIFIER FOR EACH COST RECORD.
COST,COST_EVENT_ID,YES,INTEGER,"A FOREIGN KEY IDENTIFIER TO THE EVENT (E.G. MEASUREMENT, PROCEDURE, VISIT, DRUG EXPOSURE, ETC) RECORD FOR WHICH COST DATA ARE RECORDED."
COST,COST_DOMAIN_ID,YES,STRING(20),"THE CONCEPT REPRESENTING THE DOMAIN OF THE COST EVENT, FROM WHICH THE CORRESPONDING TABLE CAN BE INFERRED THAT CONTAINS THE ENTITY FOR WHICH COST INFORMATION IS RECORDED."
COST,COST_TYPE_CONCEPT_ID,YES,INTEGER,"A FOREIGN KEY IDENTIFIER TO A CONCEPT IN THE CONCEPT TABLE FOR THE PROVENANCE OR THE SOURCE OF THE COST DATA: CALCULATED FROM INSURANCE CLAIM INFORMATION, PROVIDER REVENUE, CALCULATED FROM COST-TO-CHARGE RATIO, REPORTED FROM ACCOUNTING DATABASE, ETC."
COST,CURRENCY_CONCEPT_ID,NO,INTEGER,"A FOREIGN KEY IDENTIFIER TO THE CONCEPT REPRESENTING THE 3-LETTER CODE USED TO DELINEATE INTERNATIONAL CURRENCIES, SUCH AS USD FOR US DOLLAR."
COST,TOTAL_CHARGE,NO,FLOAT,"THE TOTAL AMOUNT CHARGED BY SOME PROVIDER OF GOODS OR SERVICES (E.G. HOSPITAL, PHYSICIAN PHARMACY, DME PROVIDER) TO PAYERS (INSURANCE COMPANIES, THE PATIENT)."
COST,TOTAL_COST,NO,FLOAT,THE COST INCURRED BY THE PROVIDER OF GOODS OR SERVICES.
COST,TOTAL_PAID,NO,FLOAT,THE TOTAL AMOUNT ACTUALLY PAID FROM ALL PAYERS FOR GOODS OR SERVICES OF THE PROVIDER.
COST,PAID_BY_PAYER,NO,FLOAT,THE AMOUNT PAID BY THE PAYER FOR THE GOODS OR SERVICES.
COST,PAID_BY_PATIENT,NO,FLOAT,THE TOTAL AMOUNT PAID BY THE PERSON AS A SHARE OF THE EXPENSES.
COST,PAID_PATIENT_COPAY,NO,FLOAT,THE AMOUNT PAID BY THE PERSON AS A FIXED CONTRIBUTION TO THE EXPENSES.
COST,PAID_PATIENT_COINSURANCE,NO,FLOAT,"THE AMOUNT PAID BY THE PERSON AS A JOINT ASSUMPTION OF RISK. TYPICALLY, THIS IS A PERCENTAGE OF THE EXPENSES DEFINED BY THE PAYER PLAN AFTER THE PERSON'S DEDUCTIBLE IS EXCEEDED."
COST,PAID_PATIENT_DEDUCTIBLE,NO,FLOAT,THE AMOUNT PAID BY THE PERSON THAT IS COUNTED TOWARD THE DEDUCTIBLE DEFINED BY THE PAYER PLAN. PAID_PATIENT_DEDUCTIBLE DOES CONTRIBUTE TO THE PAID_BY_PATIENT VARIABLE.
COST,PAID_BY_PRIMARY,NO,FLOAT,THE AMOUNT PAID BY A PRIMARY PAYER THROUGH THE COORDINATION OF BENEFITS.
COST,PAID_INGREDIENT_COST,NO,FLOAT,"THE AMOUNT PAID BY THE PAYER TO A PHARMACY FOR THE DRUG, EXCLUDING THE AMOUNT PAID FOR DISPENSING THE DRUG. PAID_INGREDIENT_COST CONTRIBUTES TO THE PAID_BY_PAYER FIELD IF THIS FIELD IS POPULATED WITH A NONZERO VALUE."
COST,PAID_DISPENSING_FEE,NO,FLOAT,"THE AMOUNT PAID BY THE PAYER TO A PHARMACY FOR DISPENSING A DRUG, EXCLUDING THE AMOUNT PAID FOR THE DRUG INGREDIENT. PAID_DISPENSING_FEE CONTRIBUTES TO THE PAID_BY_PAYER FIELD IF THIS FIELD IS POPULATED WITH A NONZERO VALUE."
COST,PAYER_PLAN_PERIOD_ID,NO,INTEGER,"A FOREIGN KEY TO THE PAYER_PLAN_PERIOD TABLE, WHERE THE DETAILS OF THE PAYER, PLAN AND FAMILY ARE STORED. RECORD THE PAYER_PLAN_ID THAT RELATES TO THE PAYER WHO CONTRIBUTED TO THE PAID_BY_PAYER FIELD."
COST,AMOUNT_ALLOWED,NO,FLOAT,THE CONTRACTED AMOUNT AGREED BETWEEN THE PAYER AND PROVIDER.
COST,REVENUE_CODE_CONCEPT_ID,NO,INTEGER,A FOREIGN KEY REFERRING TO A STANDARD CONCEPT ID IN THE STANDARDIZED VOCABULARIES FOR REVENUE CODES.
COST,DRG_CONCEPT_ID,NO,INTEGER,A FOREIGN KEY REFERRING TO A STANDARD CONCEPT ID IN THE STANDARDIZED VOCABULARIES FOR DRG CODES.
COST,REVENUE_CODE_SOURCE_VALUE,NO,STRING(50),"THE SOURCE CODE FOR THE REVENUE CODE AS IT APPEARS IN THE SOURCE DATA, STORED HERE FOR REFERENCE."
COST,DRG_SOURCE_VALUE,NO,STRING(50),"THE SOURCE CODE FOR THE 3-DIGIT DRG SOURCE CODE AS IT APPEARS IN THE SOURCE DATA, STORED HERE FOR REFERENCE."
COHORT,COHORT_DEFINITION_ID,YES,INTEGER,A FOREIGN KEY TO A RECORD IN THE COHORT_DEFINITION TABLE CONTAINING RELEVANT COHORT DEFINITION INFORMATION.
COHORT,SUBJECT_ID,YES,INTEGER,"A FOREIGN KEY TO THE SUBJECT IN THE COHORT. THESE COULD BE REFERRING TO RECORDS IN THE PERSON, PROVIDER, VISIT_OCCURRENCE TABLE."
COHORT,COHORT_START_DATE,YES,DATE,"THE DATE WHEN THE COHORT DEFINITION CRITERIA FOR THE PERSON, PROVIDER OR VISIT FIRST MATCH."
COHORT,COHORT_END_DATE,YES,DATE,"THE DATE WHEN THE COHORT DEFINITION CRITERIA FOR THE PERSON, PROVIDER OR VISIT NO LONGER MATCH OR THE COHORT MEMBERSHIP WAS TERMINATED."
COHORT_ATTRIBUTE,COHORT_DEFINITION_ID,YES,INTEGER,A FOREIGN KEY TO A RECORD IN THEŸCOHORT_DEFINITIONŸTABLE CONTAINING RELEVANT COHORT DEFINITION INFORMATION.
COHORT_ATTRIBUTE,SUBJECT_ID,YES,INTEGER,"A FOREIGN KEY TO THE SUBJECT IN THE COHORT. THESE COULD BE REFERRING TO RECORDS IN THE PERSON, PROVIDER, VISIT_OCCURRENCE TABLE."
COHORT_ATTRIBUTE,COHORT_START_DATE,YES,DATE,"THE DATE WHEN THE COHORT DEFINITION CRITERIA FOR THE PERSON, PROVIDER OR VISIT FIRST MATCH."
COHORT_ATTRIBUTE,COHORT_END_DATE,YES,DATE,"THE DATE WHEN THE COHORT DEFINITION CRITERIA FOR THE PERSON, PROVIDER OR VISIT NO LONGER MATCH OR THE COHORT MEMBERSHIP WAS TERMINATED."
COHORT_ATTRIBUTE,ATTRIBUTE_DEFINITION_ID,YES,INTEGER,A FOREIGN KEY TO A RECORD IN THEŸATTRIBUTE_DEFINITIONTABLE CONTAINING RELEVANT ATTRIBUTE DEFINITION INFORMATION.
COHORT_ATTRIBUTE,VALUE_AS_NUMBER,NO,FLOAT,THE ATTRIBUTE RESULT STORED AS A NUMBER. THIS IS APPLICABLE TO ATTRIBUTES WHERE THE RESULT IS EXPRESSED AS A NUMERIC VALUE.
COHORT_ATTRIBUTE,VALUE_AS_CONCEPT_ID,NO,INTEGER,THE ATTRIBUTE RESULT STORED AS A CONCEPT ID. THIS IS APPLICABLE TO ATTRIBUTES WHERE THE RESULT IS EXPRESSED AS A CATEGORICAL VALUE.
DRUG_ERA,DRUG_ERA_ID,YES,INTEGER,A UNIQUE IDENTIFIER FOR EACH DRUG ERA.
DRUG_ERA,PERSON_ID,YES,INTEGER,A FOREIGN KEY IDENTIFIER TO THE PERSON WHO IS SUBJECTED TO THE DRUG DURING THE FDRUG ERA. THE DEMOGRAPHIC DETAILS OF THAT PERSON ARE STORED IN THE PERSON TABLE.
DRUG_ERA,DRUG_CONCEPT_ID,YES,INTEGER,A FOREIGN KEY THAT REFERS TO A STANDARD CONCEPT IDENTIFIER IN THE STANDARDIZED VOCABULARIES FOR THE INGREDIENT CONCEPT.
DRUG_ERA,DRUG_ERA_START_DATE,YES,DATE,THE START DATE FOR THE DRUG ERA CONSTRUCTED FROM THE INDIVIDUAL INSTANCES OF DRUG EXPOSURES. IT IS THE START DATE OF THE VERY FIRST CHRONOLOGICALLY RECORDED INSTANCE OF CONUTILIZATION OF A DRUG.
DRUG_ERA,DRUG_ERA_END_DATE,YES,DATE,THE END DATE FOR THE DRUG ERA CONSTRUCTED FROM THE INDIVIDUAL INSTANCE OF DRUG EXPOSURES. IT IS THE END DATE OF THE FINAL CONTINUOUSLY RECORDED INSTANCE OF UTILIZATION OF A DRUG.
DRUG_ERA,DRUG_EXPOSURE_COUNT,NO,INTEGER,THE NUMBER OF INDIVIDUAL DRUG EXPOSURE OCCURRENCES USED TO CONSTRUCT THE DRUG ERA.
DRUG_ERA,GAP_DAYS,NO,INTEGER,THE NUMBER OF DAYS THAT ARE NOT COVERED BY DRUG_EXPOSURE RECORDS THAT WERE USED TO MAKE UP THE ERA RECORD.
DOSE_ERA,DOSE_ERA_ID,YES,INTEGER,A UNIQUE IDENTIFIER FOR EACH DOSE ERA.
DOSE_ERA,PERSON_ID,YES,INTEGER,A FOREIGN KEY IDENTIFIER TO THE PERSON WHO IS SUBJECTED TO THE DRUG DURING THE DRUG ERA. THE DEMOGRAPHIC DETAILS OF THAT PERSON ARE STORED IN THE PERSON TABLE.
DOSE_ERA,DRUG_CONCEPT_ID,YES,INTEGER,A FOREIGN KEY THAT REFERS TO A STANDARD CONCEPT IDENTIFIER IN THE STANDARDIZED VOCABULARIES FOR THE ACTIVE INGREDIENT CONCEPT.
DOSE_ERA,UNIT_CONCEPT_ID,YES,INTEGER,A FOREIGN KEY THAT REFERS TO A STANDARD CONCEPT IDENTIFIER IN THE STANDARDIZED VOCABULARIES FOR THE UNIT CONCEPT.
DOSE_ERA,DOSE_VALUE,YES,FLOAT,THE NUMERIC VALUE OF THE DOSE.
DOSE_ERA,DOSE_ERA_START_DATE,YES,DATE,THE START DATE FOR THE DRUG ERA CONSTRUCTED FROM THE INDIVIDUAL INSTANCES OF DRUG EXPOSURES. IT IS THE START DATE OF THE VERY FIRST CHRONOLOGICALLY RECORDED INSTANCE OF UTILIZATION OF A DRUG.
DOSE_ERA,DOSE_ERA_END_DATE,YES,DATE,THE END DATE FOR THE DRUG ERA CONSTRUCTED FROM THE INDIVIDUAL INSTANCE OF DRUG EXPOSURES. IT IS THE END DATE OF THE FINAL CONTINUOUSLY RECORDED INSTANCE OF UTILIZATION OF A DRUG.
CONDITION_ERA,CONDITION_ERA_ID,YES,INTEGER,A UNIQUE IDENTIFIER FOR EACH CONDITION ERA.
CONDITION_ERA,PERSON_ID,YES,INTEGER,A FOREIGN KEY IDENTIFIER TO THE PERSON WHO IS EXPERIENCING THE CONDITION DURING THE CONDITION ERA. THE DEMOGRAPHIC DETAILS OF THAT PERSON ARE STORED IN THE PERSON TABLE.
CONDITION_ERA,CONDITION_CONCEPT_ID,YES,INTEGER,A FOREIGN KEY THAT REFERS TO A STANDARD CONDITION CONCEPT IDENTIFIER IN THE STANDARDIZED VOCABULARIES.
CONDITION_ERA,CONDITION_ERA_START_DATE,YES,DATE,THE START DATE FOR THE CONDITION ERA CONSTRUCTED FROM THE INDIVIDUAL INSTANCES OF CONDITION OCCURRENCES. IT IS THE START DATE OF THE VERY FIRST CHRONOLOGICALLY RECORDED INSTANCE OF THE CONDITION.
CONDITION_ERA,CONDITION_ERA_END_DATE,YES,DATE,THE END DATE FOR THE CONDITION ERA CONSTRUCTED FROM THE INDIVIDUAL INSTANCES OF CONDITION OCCURRENCES. IT IS THE END DATE OF THE FINAL CONTINUOUSLY RECORDED INSTANCE OF THE CONDITION.
CONDITION_ERA,CONDITION_OCCURRENCE_COUNT,NO,INTEGER,THE NUMBER OF INDIVIDUAL CONDITION OCCURRENCES USED TO CONSTRUCT THE CONDITION ERA.
